{
  "manifest_id": "manifest-example-0001",
  "manifest_version": "1.0",
  "speaker_id": "spk-example-001",
  "session_id": "sess-example-2026-09-09-a",
  "assets": [
    {
      "asset_id": "asset-example-0001",
      "filename": "friday_v2_neutral_0001.wav",
      "transcript": "Good morning. I'm ready whenever you are.",
      "delivery_mode": "neutral",
      "language": "en",
      "locale": "en-US",
      "speaker_id": "spk-example-001",
      "session_id": "sess-example-2026-09-09-a",
      "take_number": 1,
      "approved": true,
      "sample_rate": 48000,
      "bit_depth": 24,
      "channels": 1,
      "duration_ms": 2350,
      "peak_dbfs": -6.2,
      "checksum_sha256": "5d41a063608dc7c286cc7b46417bdfee083f114360a9f2e275c4f8039a817ce7",
      "recorded_at": "2026-09-09T14:03:00Z",
      "mic": "example-condenser-mic-A",
      "interface": "example-audio-interface-A",
      "room": "example-treated-room-1",
      "rights_record_id": "rights-example-0001",
      "notes": "synthetic example asset, no real performer audio"
    },
    {
      "asset_id": "asset-example-0002",
      "filename": "friday_v2_professional_0001.wav",
      "transcript": "Everything's running normally.",
      "delivery_mode": "professional",
      "language": "en",
      "locale": "en-US",
      "speaker_id": "spk-example-001",
      "session_id": "sess-example-2026-09-09-a",
      "take_number": 1,
      "approved": true,
      "sample_rate": 48000,
      "bit_depth": 24,
      "channels": 1,
      "duration_ms": 1980,
      "peak_dbfs": -7.8,
      "checksum_sha256": "3e6156b1e00dd46a1e992447ffeeec7d96d1db5f9ed1457bce1d481a0067fb08",
      "recorded_at": "2026-09-09T14:05:30Z",
      "mic": "example-condenser-mic-A",
      "interface": "example-audio-interface-A",
      "room": "example-treated-room-1",
      "rights_record_id": "rights-example-0001",
      "notes": "synthetic example asset, no real performer audio"
    }
  ]
}
